{
  "schema_version": 1,
  "serial": "CUSA08034",
  "title": "SHADOW OF THE COLOSSUS",
  "last_reviewed": "2026-10-05",
  "claims": [
    {
      "scope": "initial_rendering",
      "mode": "precise",
      "finding": "beneficial",
      "confidence": "medium",
      "shadps4_version": null,
      "game_version": null,
      "comparison": {
        "disabled": "incorrect",
        "relaxed": "no_change",
        "precise": "improves"
      },
      "co_requirements": [
        "direct_memory_access"
      ],
      "summary": "Precise plus Direct Memory Access fixes several early rendering issues and can reach menus; Relaxed has no rendering impact in the cited test.",
      "evidence": [
        {
          "kind": "compatibility_issue_comment",
          "url": "https://github.com/shadps4-compatibility/shadps4-game-compatibility/issues/324#issuecomment-4195837495",
          "note": "The improvement is explicitly reported for the DMA+Precise combination; Precise alone also increased GPU-driver crashes."
        }
      ]
    }
  ]
}
