{
  "schema_version": 1,
  "serial": "CUSA03962",
  "title": "RESIDENT EVIL 7 biohazard",
  "last_reviewed": "2026-10-05",
  "claims": [
    {
      "scope": "texture_loading",
      "mode": "precise",
      "finding": "beneficial",
      "confidence": "high",
      "shadps4_version": "0.16.0",
      "game_version": null,
      "comparison": {
        "disabled": "incorrect",
        "relaxed": "not_tested",
        "precise": "improves"
      },
      "co_requirements": [],
      "summary": "Precise is the most impactful single experimental option for texture loading, but does not fully correct rendering.",
      "evidence": [
        {
          "kind": "compatibility_issue_comment",
          "url": "https://github.com/shadps4-compatibility/shadps4-game-compatibility/issues/945#issuecomment-4748988534",
          "note": "The 0.16.0 report compares stock and multiple experimental combinations and calls Precise the most impactful change for texture loading."
        }
      ]
    }
  ]
}
