{
  "schema_version": 1,
  "serial": "CUSA07211",
  "title": "FINAL FANTASY VII REMAKE",
  "last_reviewed": "2026-10-06",
  "claims": [
    {
      "scope": "reach_ingame",
      "mode": "relaxed",
      "finding": "required",
      "confidence": "high",
      "shadps4_version": null,
      "game_version": "1.03",
      "comparison": {
        "disabled": "fails",
        "relaxed": "works",
        "precise": "works"
      },
      "co_requirements": [],
      "summary": "Without readbacks the game crashes while loading gameplay; both Relaxed and Precise allow a new save to load in-game.",
      "evidence": [
        {
          "kind": "compatibility_issue_comment",
          "url": "https://github.com/shadps4-compatibility/shadps4-game-compatibility/issues/1246#issuecomment-4085153975",
          "note": "The report directly compares the default failure while loading in-game with successful in-game loading under both Relaxed and Precise."
        }
      ]
    }
  ]
}
