{
  "schema_version": 1,
  "serial": "CUSA02343",
  "title": "Uncharted: The Nathan Drake Collection",
  "last_reviewed": "2026-10-06",
  "claims": [
    {
      "scope": "post_cutscene_rendering",
      "mode": "precise",
      "finding": "beneficial",
      "confidence": "high",
      "shadps4_version": "0.19.0",
      "game_version": null,
      "comparison": {
        "disabled": "incorrect",
        "relaxed": "incorrect",
        "precise": "improves"
      },
      "co_requirements": [],
      "summary": "After the first cutscene, default rendering is almost entirely invisible; Precise restores scene rendering, while Relaxed is reported to create even more issues. Major artifacts and instability remain.",
      "evidence": [
        {
          "kind": "compatibility_issue_comment",
          "url": "https://github.com/shadps4-compatibility/shadps4-game-compatibility/issues/2645#issuecomment-5995522285",
          "note": "The 0.19.0 report directly compares default, Relaxed, and Precise after the first cutscene and states that Precise restores rendering but leaves major graphical issues."
        }
      ]
    }
  ]
}
